{
  "$schema": "https://curio.dev/schemas/example-prompt-fixture.v1.json",
  "fixtureId": "default-workflow",
  "version": 1,
  "source": {
    "path": "docs/examples/dataflows/default-workflow.json",
    "sha256": "050c649c76dadb4d6de8328def4d93b1f8194b6ba64a5df26ccd0aa9a4e68d64",
    "walkthrough": null
  },
  "prompt": "Generate eleven pseudo-random integers with a fixed seed in one Python computation step, then take their median in a second computation step that reads the first one's output.",
  "context": null,
  "required": {
    "datasets": [],
    "packages": [],
    "paths": []
  },
  "expected": {
    "nodes": [
      {
        "ref": "analysis1",
        "type": "curio.builtin/computation-analysis",
        "role": "analysis",
        "executable": true,
        "hasContent": true
      },
      {
        "ref": "analysis2",
        "type": "curio.builtin/computation-analysis",
        "role": "analysis",
        "executable": true,
        "hasContent": true
      }
    ],
    "edges": [
      {
        "from": "analysis1",
        "to": "analysis2",
        "kind": "data"
      }
    ],
    "sources": {
      "datasetIds": [],
      "paths": [],
      "urls": []
    }
  },
  "intents": [
    {
      "ref": "analysis1",
      "mustMention": [
        "random"
      ]
    },
    {
      "ref": "analysis2",
      "mustMention": [
        "median"
      ],
      "outputKind": "value"
    }
  ],
  "execution": {
    "mode": "sandbox",
    "browserOnlyKinds": [],
    "notes": null
  },
  "capability": {
    "tier": "T0",
    "needs": [],
    "skip": []
  },
  "thresholds": {
    "pass": 0.9,
    "templates": 1.0,
    "topology": 0.9,
    "dependencies": 1.0
  },
  "split": "validation",
  "review": {
    "status": "pending-owner-review",
    "draftedBy": "claude-fable-5-1 from the example JSON and its walkthrough, 2026-09-09",
    "reviewedBy": null,
    "reviewedAt": null
  },
  "consent": {
    "dataContent": "identifiers-only",
    "licence": "MIT (this repository)",
    "notes": "The prompt, the expected graph and the plan target are authored in this repository; the datasets appear only as ids."
  },
  "notes": "The default two-node workflow: the smallest thing Solve can verify end to end."
}
