{
  "$schema": "https://curio.dev/schemas/example-prompt-fixture.v1.json",
  "fixtureId": "22-storage-audio-recordings",
  "version": 1,
  "source": {
    "path": "docs/examples/22-storage-audio-recordings.json",
    "sha256": "cb5ba75c36ebedd480c66a85241c66c0fd7efb7ece8ea31ebac1637336c5c211",
    "walkthrough": "docs/examples/22-storage-audio-recordings.md"
  },
  "prompt": "Load the Example noise recordings collection from the Data Catalog: WAV recordings from noise sensors in the Chicago Loop, timed by their file names. Show each recording as a spectrogram card, then split the audio into windows of a tenth of a second, measure the level of each window, and chart the level per window in Vega-Lite.",
  "context": null,
  "required": {
    "datasets": [
      "data.curio.storage-noise"
    ],
    "packages": [
      "curio.media@1"
    ],
    "paths": []
  },
  "expected": {
    "nodes": [
      {
        "ref": "loader1",
        "type": "curio.builtin/data-loading",
        "role": "loader",
        "executable": true,
        "hasContent": true
      },
      {
        "ref": "visualization1",
        "type": "curio.builtin/vis-simple",
        "role": "visualization",
        "executable": false,
        "hasContent": false
      },
      {
        "ref": "visualization2",
        "type": "curio.builtin/vis-vega",
        "role": "visualization",
        "executable": false,
        "hasContent": true
      },
      {
        "ref": "analysis1",
        "type": "curio.media/split-audio",
        "role": "analysis",
        "executable": true,
        "hasContent": true
      }
    ],
    "edges": [
      {
        "from": "loader1",
        "to": "visualization1",
        "kind": "data"
      },
      {
        "from": "loader1",
        "to": "analysis1",
        "kind": "data"
      },
      {
        "from": "analysis1",
        "to": "visualization2",
        "kind": "data"
      }
    ],
    "sources": {
      "datasetIds": [
        "data.curio.storage-noise"
      ],
      "paths": [],
      "urls": []
    }
  },
  "intents": [],
  "execution": {
    "mode": "sandbox",
    "browserOnlyKinds": [
      "curio.builtin/vis-simple",
      "curio.builtin/vis-vega"
    ],
    "notes": null
  },
  "capability": {
    "tier": "T1",
    "needs": [
      "package-enlist:templates"
    ],
    "skip": []
  },
  "thresholds": {
    "pass": 0.9,
    "templates": 1.0,
    "topology": 0.9,
    "dependencies": 1.0
  },
  "split": "validation",
  "review": {
    "status": "pending-owner-review",
    "draftedBy": "claude-opus-5-5 from the example JSON and its walkthrough, 2026-09-28",
    "reviewedBy": null,
    "reviewedAt": null
  },
  "consent": {
    "dataContent": "identifiers-only",
    "licence": "MIT (this repository)",
    "notes": "The prompt, the expected graph and the plan target are authored in this repository; the datasets appear only as ids.",
    "sourceLicences": [
      {
        "datasetId": "data.curio.storage-noise",
        "licence": "CC0-1.0"
      }
    ]
  },
  "notes": "An audio collection: spectrogram cards, then levels per window from a package node."
}
