{
  "$schema": "https://curio.dev/schemas/example-prompt-fixture.v1.json",
  "fixtureId": "ScoutShadows",
  "version": 1,
  "source": {
    "path": "docs/examples/dataflows/ScoutShadows.json",
    "sha256": "2c1bd8480720a6ead64163ab4a90de84bf2527aa27b5c3638d67c6f59c0f2c42",
    "walkthrough": null
  },
  "prompt": "Compare two scenarios of SCOUT's high-rise shadow case on the Chicago Loop. Load SCOUT's Loop buildings from the Data Catalog; in one scenario keep them as they are, in the other first take out the 15 buildings SCOUT's second scenario removes, by their building ids, as edits I can change later on a map of the buildings, removing, raising or lowering others. In both, turn the buildings' heights into a zoom 16 height raster with SCOUT's building rasterizer, run SCOUT's Deep Umbra shadow model on it, with one season setting both scenarios share, set to summer, draw the accumulated shadow on an Autark map of its own, and take its mean and median over the ground, where the height raster is under 1.08 m. Then chart the two scenarios' mean accumulated shadow side by side, and map how the shadow changes when the buildings are removed. The rasterizer and the shadow model are not part of the standard node set, so whatever provides them needs installing first.",
  "context": null,
  "required": {
    "datasets": [
      "data.scout.loop-buildings"
    ],
    "packages": [
      "model.scout.deep-umbra@1",
      "scout.raster-conversion@1"
    ]
  },
  "expected": {
    "nodes": [
      {
        "ref": "visualization5",
        "type": "curio.builtin/autk-grammar",
        "role": "visualization",
        "executable": false,
        "hasContent": true
      },
      {
        "ref": "visualization1",
        "type": "curio.builtin/autk-grammar",
        "role": "visualization",
        "executable": false,
        "hasContent": true
      },
      {
        "ref": "visualization2",
        "type": "curio.builtin/autk-grammar",
        "role": "visualization",
        "executable": false,
        "hasContent": true
      },
      {
        "ref": "visualization3",
        "type": "curio.builtin/compare-scenarios",
        "role": "visualization",
        "executable": true,
        "hasContent": true
      },
      {
        "ref": "visualization4",
        "type": "curio.builtin/compare-scenarios",
        "role": "visualization",
        "executable": true,
        "hasContent": true
      },
      {
        "ref": "loader1",
        "type": "curio.builtin/data-loading",
        "role": "loader",
        "executable": true,
        "hasContent": true
      },
      {
        "ref": "transform1",
        "type": "curio.builtin/edit-features",
        "role": "transform",
        "executable": true,
        "hasContent": true
      },
      {
        "ref": "endpoint1",
        "type": "curio.builtin/parameter",
        "role": "endpoint",
        "executable": false,
        "hasContent": false
      },
      {
        "ref": "analysis1",
        "type": "curio.builtin/raster-calculator",
        "role": "analysis",
        "executable": true,
        "hasContent": true
      },
      {
        "ref": "analysis2",
        "type": "curio.builtin/raster-calculator",
        "role": "analysis",
        "executable": true,
        "hasContent": true
      },
      {
        "ref": "analysis3",
        "type": "model.scout.deep-umbra/accumulated-shadow",
        "role": "analysis",
        "executable": true,
        "hasContent": true
      },
      {
        "ref": "analysis4",
        "type": "model.scout.deep-umbra/accumulated-shadow",
        "role": "analysis",
        "executable": true,
        "hasContent": true
      },
      {
        "ref": "analysis5",
        "type": "scout.raster-conversion/rasterize-buildings",
        "role": "analysis",
        "executable": true,
        "hasContent": true
      },
      {
        "ref": "analysis6",
        "type": "scout.raster-conversion/rasterize-buildings",
        "role": "analysis",
        "executable": true,
        "hasContent": true
      }
    ],
    "edges": [
      {
        "from": "visualization4",
        "to": "visualization5",
        "kind": "data"
      },
      {
        "from": "loader1",
        "to": "transform1",
        "kind": "data"
      },
      {
        "from": "loader1",
        "to": "analysis5",
        "kind": "data"
      },
      {
        "from": "transform1",
        "to": "analysis6",
        "kind": "data"
      },
      {
        "from": "analysis1",
        "to": "visualization3",
        "kind": "data"
      },
      {
        "from": "analysis2",
        "to": "visualization3",
        "kind": "data",
        "slot": 1
      },
      {
        "from": "analysis3",
        "to": "visualization1",
        "kind": "data"
      },
      {
        "from": "analysis3",
        "to": "visualization4",
        "kind": "data"
      },
      {
        "from": "analysis3",
        "to": "analysis1",
        "kind": "data"
      },
      {
        "from": "analysis4",
        "to": "visualization2",
        "kind": "data"
      },
      {
        "from": "analysis4",
        "to": "visualization4",
        "kind": "data",
        "slot": 1
      },
      {
        "from": "analysis4",
        "to": "analysis2",
        "kind": "data"
      },
      {
        "from": "analysis5",
        "to": "analysis1",
        "kind": "data",
        "slot": 1
      },
      {
        "from": "analysis5",
        "to": "analysis3",
        "kind": "data"
      },
      {
        "from": "analysis6",
        "to": "analysis2",
        "kind": "data",
        "slot": 1
      },
      {
        "from": "analysis6",
        "to": "analysis4",
        "kind": "data"
      }
    ],
    "sources": {
      "datasetIds": [
        "data.scout.loop-buildings"
      ],
      "paths": [],
      "urls": []
    }
  },
  "intents": [
    {
      "ref": "loader1",
      "mustMention": [
        "building"
      ],
      "outputKind": "geodataframe"
    },
    {
      "ref": "transform1",
      "mustMention": [
        "building"
      ],
      "outputKind": "geodataframe"
    },
    {
      "ref": "analysis1",
      "mustMention": [
        "shadow"
      ],
      "outputKind": "dataframe"
    },
    {
      "ref": "analysis2",
      "mustMention": [
        "shadow"
      ],
      "outputKind": "dataframe"
    },
    {
      "ref": "analysis3",
      "mustMention": [
        "shadow"
      ],
      "outputKind": "raster"
    },
    {
      "ref": "analysis4",
      "mustMention": [
        "shadow"
      ],
      "outputKind": "raster"
    },
    {
      "ref": "analysis5",
      "mustMention": [
        "height"
      ],
      "outputKind": "raster"
    },
    {
      "ref": "analysis6",
      "mustMention": [
        "height"
      ],
      "outputKind": "raster"
    }
  ],
  "execution": {
    "mode": "sandbox",
    "browserOnlyKinds": [],
    "notes": null
  },
  "capability": {
    "tier": "T1",
    "needs": [
      "package-enlist:templates"
    ],
    "skip": []
  },
  "thresholds": {
    "pass": 0.9,
    "templates": 1.0,
    "topology": 0.9,
    "dependencies": 1.0
  },
  "split": "train",
  "review": {
    "status": "pending-owner-review",
    "draftedBy": "the SCOUT shadow step (#662), from the example JSON, 2026-10-05; its difference map on an Autark node after the Compare Scenarios node, 2026-10-17; its Towers removed node an Interaction node, 2026-10-17",
    "reviewedBy": null,
    "reviewedAt": null
  },
  "consent": {
    "dataContent": "identifiers-only",
    "licence": "MIT (this repository)",
    "sourceLicences": [
      {
        "datasetId": "data.scout.loop-buildings",
        "licence": ""
      }
    ],
    "notes": "The prompt, the expected graph and the plan target are authored in this repository; the export carries the dataset's identifier only. The dataset, and the Deep Umbra model the shadow nodes name, are SCOUT's (urban-toolkit/scout), used with the permission of its authors; the dataset carries no licence string."
  },
  "notes": "Two scenarios over a shared context, SCOUT's buildings and a season Parameter node: in each, SCOUT's rasterizer, Deep Umbra, an Autark map of the shadow and a Raster Calculator taking the statistics of the shadow over the ground, the heights as its mask, Towers removed first reading the buildings through an Interaction node whose edit log removes SCOUT's 15 by building_id; and two Compare Scenarios nodes, a chart and a difference, with an Autark map of the difference after it."
}
