{
  "$schema": "https://curio.dev/schemas/example-prompt-fixture.v1.json",
  "fixtureId": "11-autark-pbf-loading",
  "version": 1,
  "source": {
    "path": "docs/examples/11-autark-pbf-loading.json",
    "sha256": "6b8e09e096d37b1a6d68ef01869f0aa3f794f62e65046a166b1610a80b0aba41",
    "walkthrough": "docs/examples/11-autark-pbf-loading.md"
  },
  "prompt": "Show me the OSM layer stack for Lower Manhattan straight from a local extract, parsed in the browser. The file is in this checkout at docs/examples/data/lower_mnt.osm.pbf. Load buildings, roads, water, parks and the surface from it with Autark, then render a thematic map with buildings coloured by height and, beside it, a histogram of building heights where brushing a range of heights highlights those buildings on the map.",
  "context": null,
  "required": {
    "datasets": [],
    "packages": [],
    "paths": [
      "docs/examples/data/lower_mnt.osm.pbf"
    ]
  },
  "expected": {
    "nodes": [
      {
        "ref": "visualization1",
        "type": "curio.builtin/autk-grammar",
        "role": "visualization",
        "executable": false,
        "hasContent": true
      },
      {
        "ref": "visualization2",
        "type": "curio.builtin/autk-grammar",
        "role": "visualization",
        "executable": false,
        "hasContent": true
      },
      {
        "ref": "visualization3",
        "type": "curio.builtin/autk-grammar",
        "role": "visualization",
        "executable": false,
        "hasContent": true
      }
    ],
    "edges": [
      {
        "from": "visualization1",
        "to": "visualization2",
        "kind": "data"
      },
      {
        "from": "visualization1",
        "to": "visualization3",
        "kind": "data"
      },
      {
        "from": "visualization2",
        "to": "visualization3",
        "kind": "interaction"
      }
    ],
    "sources": {
      "datasetIds": [],
      "paths": [
        "docs/examples/data/lower_mnt.osm.pbf"
      ],
      "urls": []
    }
  },
  "intents": [],
  "execution": {
    "mode": "browser",
    "browserOnlyKinds": [
      "curio.builtin/autk-grammar"
    ],
    "notes": null
  },
  "capability": {
    "tier": "T1",
    "needs": [
      "browser-only-execution"
    ],
    "skip": []
  },
  "thresholds": {
    "pass": 0.9,
    "templates": 1.0,
    "topology": 0.9,
    "dependencies": 1.0
  },
  "split": "train",
  "review": {
    "status": "pending-owner-review",
    "draftedBy": "claude-opus-5-5 from the example JSON and its walkthrough, 2026-10-09",
    "reviewedBy": null,
    "reviewedAt": null
  },
  "consent": {
    "dataContent": "identifiers-only",
    "licence": "MIT (this repository)",
    "notes": "The prompt, the expected graph and the plan target are authored in this repository; the datasets appear only as ids."
  },
  "notes": "Three grammar nodes: one loads the extract, and a histogram and a map draw it, linked by an interaction edge."
}
