{
  "$schema": "https://curio.dev/schemas/example-prompt-fixture.v1.json",
  "fixtureId": "10-street-vision-cv-analysis",
  "version": 1,
  "source": {
    "path": "docs/examples/10-street-vision-cv-analysis.json",
    "sha256": "d9352503db3a1af79002c9c553c20c6a86fb07ba74e0fc34ae02b122b756da4a",
    "walkthrough": "docs/examples/10-street-vision-cv-analysis.md"
  },
  "prompt": "I want to measure street-level greenery around Lincoln Park in Chicago from street photos. Load the Mapillary street photo sample from the Data Catalog and run a semantic segmentation over the photos with the model that ships with Curio, to get each photo's per-class pixel shares and its dominant class, and show me the photos beside their overlays. Separately, load the official Chicago neighborhood polygons from the Data Catalog, rename their name column to what the join step expects, and tag each photo with the neighborhood it falls in through a spatial join. Then show me a map of the neighborhoods colored by dominant class and a bar chart of photos per neighborhood by dominant class. Also run a second segmentation over the same photos, the one I will point at a Hugging Face model, with its own photo view, spatial join and bar chart. The segmentation step is not part of the standard node set, so whatever provides it needs installing first.",
  "context": null,
  "required": {
    "datasets": [
      "data.cityofchicago.neighborhoods",
      "data.curio.mapillary-sample"
    ],
    "packages": [
      "model.curio.ddrnet23-slim@1"
    ],
    "paths": []
  },
  "expected": {
    "nodes": [
      {
        "ref": "loader1",
        "type": "curio.builtin/data-loading",
        "role": "loader",
        "executable": true,
        "hasContent": true
      },
      {
        "ref": "loader2",
        "type": "curio.builtin/data-loading",
        "role": "loader",
        "executable": true,
        "hasContent": true
      },
      {
        "ref": "transform1",
        "type": "curio.builtin/data-transformation",
        "role": "transform",
        "executable": true,
        "hasContent": true
      },
      {
        "ref": "endpoint1",
        "type": "curio.builtin/spatial-join",
        "role": "endpoint",
        "executable": false,
        "hasContent": false
      },
      {
        "ref": "endpoint2",
        "type": "curio.builtin/spatial-join",
        "role": "endpoint",
        "executable": false,
        "hasContent": false
      },
      {
        "ref": "visualization1",
        "type": "curio.builtin/vis-simple",
        "role": "visualization",
        "executable": false,
        "hasContent": false
      },
      {
        "ref": "visualization2",
        "type": "curio.builtin/vis-simple",
        "role": "visualization",
        "executable": false,
        "hasContent": false
      },
      {
        "ref": "visualization3",
        "type": "curio.builtin/vis-vega",
        "role": "visualization",
        "executable": false,
        "hasContent": true
      },
      {
        "ref": "visualization4",
        "type": "curio.builtin/vis-vega",
        "role": "visualization",
        "executable": false,
        "hasContent": true
      },
      {
        "ref": "visualization5",
        "type": "curio.builtin/vis-vega",
        "role": "visualization",
        "executable": false,
        "hasContent": true
      },
      {
        "ref": "analysis1",
        "type": "model.curio.ddrnet23-slim/image-segmentation",
        "role": "analysis",
        "executable": true,
        "hasContent": true
      },
      {
        "ref": "analysis2",
        "type": "model.curio.ddrnet23-slim/image-segmentation",
        "role": "analysis",
        "executable": true,
        "hasContent": true
      }
    ],
    "edges": [
      {
        "from": "loader1",
        "to": "transform1",
        "kind": "data"
      },
      {
        "from": "loader2",
        "to": "analysis1",
        "kind": "data"
      },
      {
        "from": "loader2",
        "to": "analysis2",
        "kind": "data"
      },
      {
        "from": "transform1",
        "to": "endpoint1",
        "kind": "data",
        "slot": 1
      },
      {
        "from": "transform1",
        "to": "endpoint2",
        "kind": "data",
        "slot": 1
      },
      {
        "from": "endpoint1",
        "to": "visualization3",
        "kind": "data"
      },
      {
        "from": "endpoint2",
        "to": "visualization4",
        "kind": "data"
      },
      {
        "from": "endpoint2",
        "to": "visualization5",
        "kind": "data"
      },
      {
        "from": "visualization1",
        "to": "endpoint1",
        "kind": "data"
      },
      {
        "from": "visualization2",
        "to": "endpoint2",
        "kind": "data"
      },
      {
        "from": "analysis1",
        "to": "visualization1",
        "kind": "data"
      },
      {
        "from": "analysis2",
        "to": "visualization2",
        "kind": "data"
      }
    ],
    "sources": {
      "datasetIds": [
        "data.cityofchicago.neighborhoods",
        "data.curio.mapillary-sample"
      ],
      "paths": [],
      "urls": []
    }
  },
  "intents": [
    {
      "ref": "loader1",
      "mustMention": [
        "neighborhood",
        "polygon"
      ],
      "outputKind": "geodataframe"
    },
    {
      "ref": "transform1",
      "mustMention": [
        "name",
        "rename",
        "column"
      ]
    },
    {
      "ref": "endpoint1",
      "slotOrderMatters": true
    },
    {
      "ref": "endpoint2",
      "slotOrderMatters": true
    }
  ],
  "execution": {
    "mode": "sandbox",
    "browserOnlyKinds": [
      "curio.builtin/spatial-join",
      "curio.builtin/vis-simple",
      "curio.builtin/vis-vega"
    ],
    "notes": null
  },
  "capability": {
    "tier": "T1",
    "needs": [
      "package-enlist:templates"
    ],
    "skip": []
  },
  "thresholds": {
    "pass": 0.9,
    "templates": 1.0,
    "topology": 0.9,
    "dependencies": 1.0
  },
  "split": "heldout",
  "review": {
    "status": "pending-owner-review",
    "draftedBy": "claude-opus-5-5 from the example JSON and its walkthrough, 2026-10-01",
    "reviewedBy": null,
    "reviewedAt": null
  },
  "consent": {
    "dataContent": "identifiers-only",
    "licence": "MIT (this repository)",
    "sourceLicences": [
      {
        "datasetId": "data.cityofchicago.neighborhoods",
        "licence": "Open Data"
      },
      {
        "datasetId": "data.curio.mapillary-sample",
        "licence": "CC-BY-SA-4.0"
      }
    ],
    "notes": "The prompt, the expected graph and the plan target are authored in this repository; the datasets appear only as ids."
  },
  "notes": "The template resolution route: its segmentation node kind lives in a package. The photos and the model are committed, so it runs offline."
}
